id,number,title,mergeCommit,changedFiles,changedPackages
MDExOlB1bGxSZXF1ZXN0MTYzMDYxMjM=,863,Build Javadoc for OkUrlFactory and OkApacheClient.,a9ad5e4a256841de6ae16408367cd700135f94ba,3,
MDExOlB1bGxSZXF1ZXN0MTYzNTI5ODg=,867,First couple recipes.,2c7dd5e6df399ff738a58f06a8b3fd093b9583f8,1,
MDExOlB1bGxSZXF1ZXN0MTYzNzE2MDg=,868,Don't lose uncaught exceptions.,7cee6cd65b01ce000c593cd242b86d21cd683e52,2,
MDExOlB1bGxSZXF1ZXN0MTY0MDg3Nzg=,872,Recipes for Gson and Caching.,8abf6ef26706eed537a295942b2db3375dbb173f,2,
MDExOlB1bGxSZXF1ZXN0MTY0MTEyNTU=,874,Expose backwards-compatible response source header.,23909c9db91e46f89c3ee8e3d1354974221a553b,4,
MDExOlB1bGxSZXF1ZXN0MTY1MDMzNTc=,877,Restore Java 7-specific override annotation.,17fd27786fe6a607bbf01cd07de30cea93c3c34d,1,
MDExOlB1bGxSZXF1ZXN0MTY1MTY1NzE=,878,Response.isSuccessful().,86e7c058b9771b84ba36af0c1bb3d0db74478ea0,3,
MDExOlB1bGxSZXF1ZXN0MTY1NjIxMTA=,884,Add missing copyright headers.,34ce5f5bc0502a9d299b56ab1377e19f204c501b,3,
MDExOlB1bGxSZXF1ZXN0MTY1NjY4NDI=,886,Some POST samples.,6a41e4da9dc16eb52e411c01bc0c82b6eea22d74,1,
MDExOlB1bGxSZXF1ZXN0MTY1NzEzODI=,887,Write continuation frames when hpacked data is larger than 16383 bytes.,49af7592479a92094f0139c67eacdefc4f756cf3,2,
MDExOlB1bGxSZXF1ZXN0MTY1NzU3ODU=,888,Give each recipe its own file.,520ae94de014ff1f92b1d2ec40a9e87e1621ef2e,8,
MDExOlB1bGxSZXF1ZXN0MTY1NzU5ODA=,889,Cancel recipe.,aa94f728a16c07abc2ee94e4d9c4551099642741,1,
MDExOlB1bGxSZXF1ZXN0MTY2OTMxMjk=,892,Recipe to clone OkHttpRequest for per-request config changes.,2b8d4dbc769356741224af9f92aad0e0aac25cb8,1,
MDExOlB1bGxSZXF1ZXN0MTY2OTMyOTQ=,893,Recipe for configuring timeouts.,112d518727bd612c8ed8c73e60f084a215c90a6a,1,
MDExOlB1bGxSZXF1ZXN0MTY4MDc2MjM=,897,Fix a regression in connection cleanup.,57bd7eac9115189c199c9f529ea2318ebdb63dbf,1,
MDExOlB1bGxSZXF1ZXN0MTY4NjQ1MzU=,901,Add a Headers recipe.,75defc03acd13e5277943f20ba1d868177511fa0,2,
MDExOlB1bGxSZXF1ZXN0MTY4NzE2NTA=,904,Eat mimecraft.,f4b2835f2bb0d3273e90c54d408afb5b28e93b70,4,
MDExOlB1bGxSZXF1ZXN0MTY5MDA2Nzc=,906,Allow optional content-type for RequestBody.create with file param,72bdbfc8d26f20f76b7ce5f4a1289e3947ecdde8,1,
MDExOlB1bGxSZXF1ZXN0MTY5MTkzODU=,909,Don't skip client stream 1 on SPDY/3.1.,5d1c4bf56e06d1888103981915dd0c07b65aa6df,3,
MDExOlB1bGxSZXF1ZXN0MTY5MTk4MjA=,910,Always configure NPN.,93fa189c42fb26ddc62bac690c2c07d1fbfdf8e7,1,
MDExOlB1bGxSZXF1ZXN0MTY5MjIxNjQ=,911,Revert builder-esque return types from OkHttpClient.,7a6d8a36837a38c16e932fa54199d42aed328eb6,2,
MDExOlB1bGxSZXF1ZXN0MTY5NzI5MzA=,913,Keep the response body alive after the callback.,5ba06e009e7eb085aa1fe2856b3b7e9434335729,3,
MDExOlB1bGxSZXF1ZXN0MTY5NzYxNzY=,914,New API: Headers.of().,95725ffc23d902437fee048edef91896bbd8fb70,3,
MDExOlB1bGxSZXF1ZXN0MTY5NzY3MDU=,915,Don't include a weird user-agent in the new API.,7a6707d88b228f2d5a76cae10c07bb791e189a0e,4,
MDExOlB1bGxSZXF1ZXN0MTY5NzY3NDQ=,916,Multipart POST example using imgur's API.,94c9a9749dc8eb79891d4eccad684c53192b277d,1,
MDExOlB1bGxSZXF1ZXN0MTY5NzkzMzc=,918,Test bogus scheme.,9405e7b3f27c5ec88431deef1beaf057c72589e6,1,
MDExOlB1bGxSZXF1ZXN0MTcwMzExNzI=,920,Initial web socket API.,4953ef9520a6a3822b32c956027f592a204f60bf,3,
MDExOlB1bGxSZXF1ZXN0MTcwMzQ1NjA=,922,Examples for authenticating and posting a form,75a59aa8e55d4a77836d48ae9028b68bb22be4b9,2,
MDExOlB1bGxSZXF1ZXN0MTcwMzY0OTE=,923,Use IOException in Callback failure method.,c676928d5320c07068d458a1666e905e9fa88f58,6,
MDExOlB1bGxSZXF1ZXN0MTcwOTgxMzQ=,927,Implement message reader.,88aed983acd50986803b37aead28a4d56f18da1f,7,
MDExOlB1bGxSZXF1ZXN0MTcyMDIxMzY=,932,Implement message writer.,471f02d54377f203cb98b9d3d3535746595bbfa4,4,
MDExOlB1bGxSZXF1ZXN0MTcyNTk3NDc=,935,Update the language level to Java 7.,da4a40d82f0a47bdb6122cb38d1078b6e6e08d1e,44,
MDExOlB1bGxSZXF1ZXN0MTcyNzI1ODE=,939,Fix two problems with the window size.,8c3002f95a80df8c90360c7580eca2ae237ea7ac,4,
MDExOlB1bGxSZXF1ZXN0MTcyNzQyMjM=,940,Use a better message for impossible requests.,a4923cdca810412f030f232a8042eda7b0ea54bc,1,
MDExOlB1bGxSZXF1ZXN0MTcyNzc1NjI=,941,Pass causing exception through on malformed URL.,dd2ef5d54a9018cc1726cf4e14f15c5bce53b32f,1,
MDExOlB1bGxSZXF1ZXN0MTczNDc4Njk=,948,Fix a bug where we weren't storing rewritten request headers.,ccdb751faaf6e664fc80026a0645e183b860ddab,2,
MDExOlB1bGxSZXF1ZXN0MTc0MzI3ODM=,952,Upgrade to Bouncy Castle 1.50,25b290f2a87e72604d29bdadab614c142230a156,1,
MDExOlB1bGxSZXF1ZXN0MTc0MzYxODc=,953,Unindent the website samples.,0a941865f35ae03b36577df09297a3bae7f2e252,1,
MDExOlB1bGxSZXF1ZXN0MTc0NDE4Njk=,954,Implement HTTP/2 Draft 13; HPACK Draft 08.,16e1989c6ec6f220c1c0b87cbc1b317edd5e84f7,16,
MDExOlB1bGxSZXF1ZXN0MTc0NDM1NjA=,955,Fix a bug where the cacheResponse's request method was wrong.,d01cd2ff97e473ef4b2df24124bed3e91f9d5e4f,3,
MDExOlB1bGxSZXF1ZXN0MTc1MTI1ODE=,961,Eagerly create Entry Files for every value.,ce21afed256f4b3f0b6051d4106e02def874d403,1,
MDExOlB1bGxSZXF1ZXN0MTc3MzU5MDc=,969,Update MultipartBuilder to support content length.,63bc285596ea984aa4d4d8dd40fa4110c0a12720,2,
MDExOlB1bGxSZXF1ZXN0MTc3MzYwMzQ=,970,Mention correct Java version on the website.,05c8543ed7d3951718ffe310be5f6f8da4c74afb,1,
MDExOlB1bGxSZXF1ZXN0MTc3MzYwODc=,971,Use Okio's appending sink for File.,a67dcd46142aea8d72a0f7100ccda3b7cb9332f7,1,
MDExOlB1bGxSZXF1ZXN0MTc3Mzg0NjY=,972,Move connect to be closer to connection.,f80714ef82c0a928dc7eb884e102fcca9f64fb91,8,
MDExOlB1bGxSZXF1ZXN0MTc3NDEwMTQ=,973,Make it possible to mock OkHttpClient and Call.,cadf8ac4923f7d065d53b71bf1af5cf36d981418,3,
MDExOlB1bGxSZXF1ZXN0MTc3NTI4MDM=,976,Add hpack-test-case based tests,933d1814f33abd74ea42629ce05d213534622f71,12,
MDExOlB1bGxSZXF1ZXN0MTc3NTM3MjE=,977,Hook up the web socket reader and writer together.,a0972495a460fe8658452585970b94b9ebdfea57,16,
MDExOlB1bGxSZXF1ZXN0MTc4OTAyOTg=,981,HTTP/2 initial window size is 65535 not 65536,5c31a1cd40feb4a3de138d3d16ca4036fa616fac,2,
MDExOlB1bGxSZXF1ZXN0MTgxNDQ2NTM=,987,Add trailing CRLF to multipart.,587e5a89b54042b330d7ffef5ee7013f96c10d51,2,
MDExOlB1bGxSZXF1ZXN0MTgyMjQ5NjA=,989,Use urlString for Request.toString(),c32df72ac884b8872c2c80380191004d7ab7e6d9,1,
MDExOlB1bGxSZXF1ZXN0MTg2MzcwNDA=,996,Permit GETs to have Content-Length: 0.,aab60222c4a3c46773316d27a2ab0a9f9910dcfe,1,
MDExOlB1bGxSZXF1ZXN0MTg2Nzc0NDA=,997,Use the socket factory for direct connections as well.,75f0603fe98cafd9c1a058ed85b301b8b1828b4a,2,
MDExOlB1bGxSZXF1ZXN0MTg3OTI0NzY=,1000,Cookies tests are flaky,b3b159d3b94404cb0d47110860324238bacfa8ce,1,
MDExOlB1bGxSZXF1ZXN0MTg4NTQ4MTI=,1002,Allow callers to pass in a custom host resolver implementation.,deeb0bcfabf1bd7439dee0c80fc2a8f1d56ce997,5,
MDExOlB1bGxSZXF1ZXN0MTg5Mzc0MzE=,1003,"add info about spdy version, npn and also make it pass wc3 validaton",32d8b3469a79562000fc5018c42f68b6ca7e175b,1,
MDExOlB1bGxSZXF1ZXN0MTkwMzAxMDU=,1006,Fix transparent gzip for basic auth.,869b9cf66f22f0391630c657ebbfa042c4af40d7,7,
MDExOlB1bGxSZXF1ZXN0MTkxNDM3Mzc=,1010,Add a regression test for transparent gzip + basic auth,cb1f9b3fefcededbb303c2d2c04d79708a639a61,1,
MDExOlB1bGxSZXF1ZXN0MTk1NTc4MTk=,1020,Bump Okio dependency.,b0ad2c0a18f4145fd5f641e1a49c97148407f7f2,1,
MDExOlB1bGxSZXF1ZXN0MTk4OTQ0MDg=,1023,Convert disk cache to use Okio.,392024ae9e7f75094fb5b368a09b177a05738977,10,
MDExOlB1bGxSZXF1ZXN0MjA5NzA1NTA=,1046,Update to h2-14 and hpack-9,e100d061cdac0d2b9d5b4eb880c4fcb00ed4a257,25,
MDExOlB1bGxSZXF1ZXN0MjEzMTk3Mjk=,1054,Allow 'http' and 'https' URLs for convenience.,3b1ac7becafab4b4c14cd4d086aacd2d6bc722e9,1,
MDExOlB1bGxSZXF1ZXN0MjE1OTE3NTc=,1057,Move frame length constraint to where it is used.,28b3c60ec466872c3efd09367522d0bd5b367c74,8,
MDExOlB1bGxSZXF1ZXN0MjE4OTcxMjg=,1063,Include a user-agent by default.,5e3cb0b8852d60c903826efc30f0b1d5067431b1,4,
MDExOlB1bGxSZXF1ZXN0MjE5MDQzNDg=,1064,Unused imports.,898e1671062262f616a5a76054fcbcb0c7d0577e,2,
MDExOlB1bGxSZXF1ZXN0MjE5MDUwOTE=,1065,OkHttpClient.cancel(tag) doesn't cancel in-flight synchronous requests.,d22e1b8a6e45b9c8ea4b1f7b24d59e30364da409,4,
MDExOlB1bGxSZXF1ZXN0MjIyNDUyNDI=,1072,Handle response code 308 - Permanent Redirect,d6844d557b30b490a0a5bd0fbd4312a0adef889d,6,
MDExOlB1bGxSZXF1ZXN0MjI1OTcxMDg=,1079,Clean up HostResolver.,e8af802664b32fe579de2b909254a776e28e5201,5,
MDExOlB1bGxSZXF1ZXN0MjI1OTczNTI=,1080,Forbid setProtocols with HTTP_1_0.,56c389d8da7f434a0e100231653afcfed2a447ff,3,
MDExOlB1bGxSZXF1ZXN0MjI1OTg1MzM=,1082,More convenient APIs for using Cache-Control in requests.,c19740a962505171098181eaa35cdddf065f6d49,4,
MDExOlB1bGxSZXF1ZXN0MjI2MDQwNzE=,1085,Extend the keep-alive time for the SPDY push executor.,91e74265cff49c7c2e4e6d78eeb154eb4ece3906,2,
MDExOlB1bGxSZXF1ZXN0MjI2MTEwMTA=,1086,Certificate pinning.,cfa677589ec4dfb2a97a97ab1c4adff50362b1a9,15,
MDExOlB1bGxSZXF1ZXN0MjI2MjAzMjU=,1087,Revise how TLS connections are negotiated.,839874061e7402e66c5fbe510dd527d6e31597ce,11,
MDExOlB1bGxSZXF1ZXN0MjI2MjQ4MTk=,1088,Fix inverted condition on Route's forwarding constructor.,8e137b5e642fac5bb77493001d37820843c2d091,1,
MDExOlB1bGxSZXF1ZXN0MjI2NTcyNzc=,1089,Introduce ConnectionConfiguration.,ef0713977a22e512a5023db31861dc8991548a4f,11,
MDExOlB1bGxSZXF1ZXN0MjI3MTgzNDA=,1093,Only read hpack tests for the current draft.,6e52ac4846d6251b2b7d6fe466d5bdd7571e2089,4,
MDExOlB1bGxSZXF1ZXN0MjI4MzI3MTU=,1095,Change Headers.Builder to be final.,e743ad7a03b9e2cb7d7cbdc85340908b61bfc27d,1,
MDExOlB1bGxSZXF1ZXN0MjMzNDA0MTk=,1102,Fix a bug where the response cache could be corrupted.,9c4dce6c1f1373fa9ae12718648db6a947e7c9a5,11,
MDExOlB1bGxSZXF1ZXN0MjMzNDQ2MDM=,1103,Log uncaught IOExceptions instead of rethrowing them.,fc075bc55ad83a5c18b0b5f5ddaa627685d6ff32,4,
MDExOlB1bGxSZXF1ZXN0MjMzNDY2NjE=,1104,"Add an accessor, Call.isCanceled().",bcb8487511c6e823569acd2a34b9232c5e7f3f61,1,
MDExOlB1bGxSZXF1ZXN0MjMzNTI1MDE=,1107,Use one logger for all logging.,616e769984a5853cecf0a9e33ab6b1dc642c7cee,5,
MDExOlB1bGxSZXF1ZXN0MjM3MjAyNjA=,1112,Fix request cache-control to match spec.,97beb7f6348a7d9e8d0aa9333ec876de1e1e39e4,4,
MDExOlB1bGxSZXF1ZXN0MjM3MjA3MDU=,1113,Change the cache to have non-shared semantics.,7029f425b87d6585cd2d095064b843a24610db08,4,
MDExOlB1bGxSZXF1ZXN0MjM3MzIyMjM=,1115,Attempt to improve MockWebServer reliability.,5d9442f77f298bf7547fcba4200ab64084aa7eb2,4,
MDExOlB1bGxSZXF1ZXN0MjM3MzI5MDI=,1116,Don't close the SPDY peer too early.,1c316ade64ea2716e5c0f564400eb3932bdc3432,2,
MDExOlB1bGxSZXF1ZXN0MjM3MzM4Nzk=,1117,Don't skip the callback if a call is canceled.,492859db453e17dd1c41f37c52ef664ff0e04639,4,
MDExOlB1bGxSZXF1ZXN0MjM4MDczMzc=,1121,Be consistent about host names in RouteSelector.,f03a0d335a05b9ace7b5beaea4249af19ba95c91,1,
MDExOlB1bGxSZXF1ZXN0MjM4MTEwODg=,1123,Import DiskLruCache tests.,827418cfbf497d902286e76506ff2bec17284c0b,2,
MDExOlB1bGxSZXF1ZXN0MjM4MzczNDY=,1124,Implement DiskLruCache.evictAll and expose it in Cache.,9bb969c6ce5e5bcf21060a6bca6663d8bfce2457,4,
MDExOlB1bGxSZXF1ZXN0MjM4NzgyMDU=,1127,Adjust new 2.1 APIs.,9e0706ca8ddadb438636c30da6e0cafb500259b4,2,
MDExOlB1bGxSZXF1ZXN0MjM4ODA4NDk=,1128,Rename ConnectionConfiguration to ConnectionSpec.,320fb6eab3e223648790dc65566f956aeec2f472,11,
MDExOlB1bGxSZXF1ZXN0MjM4ODczMDI=,1129,Websockets!,56ff028deaf5b44210c225587599641c1d3dd4d0,19,
MDExOlB1bGxSZXF1ZXN0MjQxODc2ODE=,1143,Request body buffering is not transport-specific.,ffced0eb17e348d9636cecbdda60f2dc5db4dc70,16,
MDExOlB1bGxSZXF1ZXN0MjQxOTk1ODI=,1145,Accept other messages when testing canceled requests.,bcadf052b894be458ba51ffdbd5c8bdeb3fb93ca,2,
MDExOlB1bGxSZXF1ZXN0MjQyNzA5NzM=,1147,Cherry pick fixes for OkHttp 2.1.0.,2ed2c01a0c6c3bfc48f7440664181534693a16e9,23,
MDExOlB1bGxSZXF1ZXN0MjQ1MzkyMzE=,1154,Bump to 2.1.0 in README,42bfae91fe632e50257424b0a7d12322fa564a8f,1,
MDExOlB1bGxSZXF1ZXN0MjQ3MjY1NzQ=,1160,Use new central artifact redirect link.,969dadedf96f4cfdc826278aedb95fd3e76c15a8,3,
MDExOlB1bGxSZXF1ZXN0MjQ5MTY4MzQ=,1162,Update to HTTP/2 Draft 15.,33642311b2260e4c2b4cf0a64f6c82a66396547a,11,
MDExOlB1bGxSZXF1ZXN0MjUwODY2NDA=,1168,Avoid hardcoding the custom header prefix,40ed452b692c555536fa29809a1049f95d48b5c3,1,
MDExOlB1bGxSZXF1ZXN0MjUxMDIyMTE=,1170,Prevent MockSpdyPeer interfering with Android tests,5685de6e7b0d00fadd6a21b1a8327a3caa665396,1,
MDExOlB1bGxSZXF1ZXN0MjUxOTg3NTU=,1171,Modify bad CONNECT handling,5f741c0aa78e9f10ce57c40a2e0cf1adedb252d5,2,
MDExOlB1bGxSZXF1ZXN0MjUyNDA1Mjg=,1177,Remove unused local which was always null.,9807f2e3448d29012d4037f6fa050dc4a066379f,1,
MDExOlB1bGxSZXF1ZXN0MjUyNTYxODY=,1178,Fix for a socket leak in OkHttp on Android,95f0aad2046ac220ba066e20560f07fd23891024,2,
MDExOlB1bGxSZXF1ZXN0MjU1MjEyNDU=,1187,"Strict, modern HostnameVerifier.",f283677d9bec506835f99511a759c18b278c0b2f,2,
MDExOlB1bGxSZXF1ZXN0MjU2NTE5NzY=,1193,Initial implementation of interceptors.,07b7e3648b8a34bcc301f3f5dba0a295551aa0cc,5,
MDExOlB1bGxSZXF1ZXN0MjU2ODc5ODQ=,1194,mockwebserver: bind specifically to a loopback interface,69d6f4244fddc8b8dda1fc4ebcd885761c74463b,2,
MDExOlB1bGxSZXF1ZXN0MjU4MzQ0NDU=,1196,Change COMPATIBLE_TLS to be TLSv1.0 and not SSLv3,41a344c111d7d64ceaa001f74402d480683f4788,1,
MDExOlB1bGxSZXF1ZXN0MjU5NjY2MTg=,1197,Apply fix for devices with large socket buffers,7b2ae6f7ddd0f35a5707c77dd9543b2571808c26,1,
MDExOlB1bGxSZXF1ZXN0MjYwNzI1Mzg=,1201,Remove NPN support from OkHttp,29170bfa4c9910ec3e38b1bcecf723be5c1e8147,12,
MDExOlB1bGxSZXF1ZXN0MjYxMTU4MTE=,1205,Update to Okio 1.1.0.,7cb076134aa7b25bbd244753cbe108301d29977a,4,
MDExOlB1bGxSZXF1ZXN0MjY0MTMxMDY=,1214,Auto-deploy snapshots from Travis CI to Sonatype.,87dc825a78c5d405899b7bb73b3e1e9b8c2c5f2a,4,
MDExOlB1bGxSZXF1ZXN0MjY0MjY3NTE=,1217,Update MWS test style to match project.,0603922ee33f25b9020c42d5eadb45935bceae03,1,
MDExOlB1bGxSZXF1ZXN0MjY0MzA2NDI=,1218,Move cache writing out of the transport.,657c503469f93b81bb5882d9a76eaf103479f48b,11,
MDExOlB1bGxSZXF1ZXN0MjY0Mzg0NTg=,1219,Use ResponseBody to model the response body everywhere.,fe1de2d01a8af4cc68180c6292b582f56ee28303,8,
MDExOlB1bGxSZXF1ZXN0MjY0NjM3MzQ=,1220,Network interceptors.,d36e14979bd14b8a3614bb084146f5a14756c744,6,
MDExOlB1bGxSZXF1ZXN0MjY0OTEwMTg=,1222,Just some small tweaks.,e821c1a2f79cb24ede89ce0eb3cb271b8c9f92b2,1,
MDExOlB1bGxSZXF1ZXN0MjY0OTU5MDM=,1223,More interceptor tests.,623d953bbf31733fc67203f3997b1ea82f4217a3,2,
MDExOlB1bGxSZXF1ZXN0MjY0OTg4NDU=,1224,Use native Okio copy for retrying.,330e7b26b4df7ca824c348c922be31b9bb20622a,1,
MDExOlB1bGxSZXF1ZXN0MjY1NDI2MzY=,1226,Two interceptor samples.,7f50a0ffd0089ec9c4f8ad1f7dc0dd4a205d52be,3,
MDExOlB1bGxSZXF1ZXN0MjY1NjM5MTI=,1227,Two more interceptor examples.,c0bb769a436866b83adb3951f24474331c8c9746,2,
MDExOlB1bGxSZXF1ZXN0MjY1Njc0NTI=,1228,Version header is always present.,e43457e97cff1bd42eb948adbc6bf9128e972763,1,
MDExOlB1bGxSZXF1ZXN0MjY1Njc0NjA=,1229,Normalize caching size in loop-local variable.,3c59d1c2bcf8f603bf96a30ddb5574379ed575d3,14,
MDExOlB1bGxSZXF1ZXN0MjY1Njc4Nzk=,1230,Use Okio's readFully(byte[]) instead of custom implementation.,180966efba6e1c35ff70abe3c3fff8579543c101,2,
MDExOlB1bGxSZXF1ZXN0MjY1Njc5NjI=,1231,"Move method to test module, its only place of use.",8b7c9959d3fbfe94ff2673a037307b201cb0e88b,8,
MDExOlB1bGxSZXF1ZXN0MjY1Njk0MjU=,1233,Use a name more appropriate for both SPDY and HTTP/2 connections.,d12bd08c9fc369cbf8ef07a9f46ed4b9c0433f1c,2,
MDExOlB1bGxSZXF1ZXN0MjY1NzA1OTI=,1234,Remove some needless allocations.,6fd717ff0c2752bbe09b07fcdb400359449de1aa,5,
MDExOlB1bGxSZXF1ZXN0MjY1ODgyNjA=,1235,Don't NPE if disconnecting before connecting.,9304bd6a13de2826cda35927f57886bd3d8f4395,2,
MDExOlB1bGxSZXF1ZXN0MjY1OTAyMjY=,1236,Source-incompatible: RequestBody.contentLength() throws IOException,b9fb7bbe7a1eb4fcc4ad7581550c8e5a654739b6,6,
MDExOlB1bGxSZXF1ZXN0MjY1OTE1MzM=,1238,Nfuller fix pool leak,85575f010eca306f5248667320a9d2c9843a065c,2,
MDExOlB1bGxSZXF1ZXN0MjY2MDg2MDE=,1243,Nfuller change alpn npn support,c5f3866bb7fe154dc81ba2328fc2b47623117414,12,
MDExOlB1bGxSZXF1ZXN0MjY2MTY2NDk=,1244,Always call ALPN.remove() after handshake.,8516d4ba4627bf0220fb98f0d0de158ea8d4aa90,3,
MDExOlB1bGxSZXF1ZXN0MjY2MTY2NjU=,1245,Use MockWebServerRule in more tests.,5b9fcde115c3f75a3ae5847755c10345697aea01,6,
MDExOlB1bGxSZXF1ZXN0MjY2MTczMTY=,1246,Update ALPN.,3904d4fe0a56b4c6ced599b4250342fedc6f2eb8,1,
MDExOlB1bGxSZXF1ZXN0MjY2MTkyMjQ=,1247,Fix pooling with proxy selectors.,1b34c5655d5f4dea9fbbce24fa7da5f17d1497ae,5,
MDExOlB1bGxSZXF1ZXN0MjY2MjA0NTY=,1248,Support SOCKS proxies.,82879a7bdb29e9629b2c15facef11511982c9323,4,
MDExOlB1bGxSZXF1ZXN0MjY2MzA1OTc=,1249,Respect the max idle connections limit.,002b91fd51ea79c2c9f631ea0ecd3459f1b63b9b,3,
MDExOlB1bGxSZXF1ZXN0MjY2NTQ0ODA=,1250,New API for iterating DiskLruCache contents.,e872c50e49e4a0d35bcfcd6fe0c05e057b7748d9,2,
MDExOlB1bGxSZXF1ZXN0MjY2NTc1NTM=,1251,Don't reuse ephemeral port numbers.,68d699d005d8cd6aca1eaaef45ec15c1afff7126,1,
MDExOlB1bGxSZXF1ZXN0MjY2NjQ3NjA=,1252,New APIs to iterate the response cache.,d121c051295a05f0c3966125d46e078a1d19ce37,4,
MDExOlB1bGxSZXF1ZXN0MjY2NjYwOTE=,1254,Cache 302s and 308s with the right response headers.,16fc42c3b1b936f41f5cd368ad984b9e61a3eaa4,3,
MDExOlB1bGxSZXF1ZXN0MjY2ODc1MzQ=,1256,Limit 20 authorization attempts.,425bfcd0510287082ae19a1719c5f085563a39f0,5,
MDExOlB1bGxSZXF1ZXN0MjY2ODk3MzU=,1257,Don't recover from timeouts.,33f10f7788b2172bbd01895c6fb99f6ba278e936,4,
MDExOlB1bGxSZXF1ZXN0MjY3MDk2OTQ=,1259,New API to disable retry for an OkHttpClient.,68619ab876595cb1baa14e9b31e6301814cf8a2f,3,
MDExOlB1bGxSZXF1ZXN0MjY3MTUxNDk=,1260,Add a web socket call concept for connecting.,244ace0699bc3e2975a99d9d7a370627264bd3d6,20,
MDExOlB1bGxSZXF1ZXN0MjY3MTYyODA=,1262,Remove unused method.,47743156edd684467fb3af4ffd766e8796de05a9,1,
MDExOlB1bGxSZXF1ZXN0MjY3MjY1OTY=,1263,Update CHANGELOG.md,0bb02819b9266601c0f6f5d4c493ce110d0332e2,1,
MDExOlB1bGxSZXF1ZXN0MjY3MzE3MzI=,1264,Skip buffer allocation when not needed.,ca2a4e0332af6b1902c2605987e4ebbe7c77f817,1,
MDExOlB1bGxSZXF1ZXN0MjY3NTE2MTE=,1267,Promote adding headers by line to public API.,5693fbdd4526c93f795772bf965ac8a3767e1c48,6,
MDExOlB1bGxSZXF1ZXN0MjY3NjY0ODE=,1268,Always include OkHttp in thread names.,8bb580d261638cf9d7d5962037739a3c1237e165,4,
MDExOlB1bGxSZXF1ZXN0MjY3Njk5OTc=,1269,Correct comment.,b675a8a5a49e48bfe65cfa3c7c2ba086648ff53f,1,
MDExOlB1bGxSZXF1ZXN0MjY3NzE0Njk=,1270,Update MockWebServer to use Headers.,5efd256ac1a674fc523d1094d2a90f0ec60447c7,10,
MDExOlB1bGxSZXF1ZXN0MjY3NzIzMjM=,1271,Use TlsVersion enum for recorded requests.,087ea473f2f3778c5ed3bf68dc8860dc2faca12d,4,
MDExOlB1bGxSZXF1ZXN0MjY3NzI4Mjk=,1272,Use a Buffer for body contents.,cbae5968dc316558ac0625b0142f1db9bfed456c,8,
MDExOlB1bGxSZXF1ZXN0MjY3NzMyNzQ=,1273,Make TlsVersion and CipherSuite parsing methods public.,94c571701bf3116a752517438f67716bcc0e6271,5,
MDExOlB1bGxSZXF1ZXN0MjY3NzQ1NzU=,1274,"Test Expect: 100-continue with OkHttp, not HttpURLConnection.",1f20851ab9b79c73872a4e55d2d15850fb9041fb,2,
MDExOlB1bGxSZXF1ZXN0MjY3NzYyODM=,1275,Skip allocating a wrapper list for copying.,4c8e741983bb434232f705acf6ae598a60499e2b,1,
MDExOlB1bGxSZXF1ZXN0MjY3ODEwMDE=,1279,Make readMessage public for future MWS usage.,c54ef4cd166e3ff15a4a8d0aa9c9568fbfc4b0ce,1,
MDExOlB1bGxSZXF1ZXN0MjY3ODE4Mjc=,1280,Teach MockWebServer to speak WebSockets.,890b5e894c016e23142bb3d6b12fbf5d7f4b977a,9,
MDExOlB1bGxSZXF1ZXN0MjY3OTM3MjU=,1282,Use Sources and Sinks for all IO.,80c8c5da7264a16cb9cabdcfea902a848a100b61,4,
MDExOlB1bGxSZXF1ZXN0MjY3OTQwMDc=,1283,Make cache-control remember its header value.,5fe734c632ea1cce68b845fb3e641edbcd346622,2,
MDExOlB1bGxSZXF1ZXN0MjY4MDI1OTY=,1285,Remove ALPN jars from dependencies block.,5bd9900e64a6da396759cea692eb00ad9c6b7210,1,
MDExOlB1bGxSZXF1ZXN0MjY4MDc0MDY=,1288,Correctly link to OkHttp and Okio javadoc.,1388d868970398be21acc40af243138cf1d412c3,1,
MDExOlB1bGxSZXF1ZXN0MjY4MDgzODc=,1289,Clean up time-based APIs for throttle and delay.,c44102e06f50d2099fd7974ac043d2c404e76291,4,
MDExOlB1bGxSZXF1ZXN0MjY4NzIwMzc=,1297,Use 'Headers' in recorded response.,ca1158adac0f4ecbc82ffad3f4bf6b6221885626,12,
MDExOlB1bGxSZXF1ZXN0MjY4NzI1NTU=,1298,Remove old SSL protocol method.,f6505180919959c4ea8f9f8dd4512c57601c739f,3,
MDExOlB1bGxSZXF1ZXN0MjcxMDcwNDI=,1307,Source-incompatible: ResponseBody methods throw IOException,56de69e960b1b3d8b28a968e813c112d552fcf36,3,
MDExOlB1bGxSZXF1ZXN0MjcxNjE0Njg=,1310,Lazily initialize the cache.,65be77a99583395f44e6c0adbbb10666e2219d47,3,
MDExOlB1bGxSZXF1ZXN0MjcxOTM0NzU=,1313,Fix isClosed() when a cache has not been initialized,d7abb2f38cbb413985b753429e8f6204683f76b0,2,
MDExOlB1bGxSZXF1ZXN0MjcyMzI3NDk=,1315,Move stringy test methods to test class.,b4405a536f383e52cec3e55c795615bf1b8a4f1b,2,
MDExOlB1bGxSZXF1ZXN0MjcyMzU3NTg=,1316,Empty sinks must still honor the contract by consuming the bytes.,d7ec9e21684105205902f4587f8c2be23570a57d,1,
MDExOlB1bGxSZXF1ZXN0MjcyNzIxNDk=,1321,Fix the user agent test so it works with a different user agent string,52482168446a123086c8fcc0f7f1c0273d890ebb,1,
MDExOlB1bGxSZXF1ZXN0MjczMTUxMjU=,1323,Hurry up connection pool shutdown.,8d04a058689e41c74967d7d7b339626f720a693a,1,
MDExOlB1bGxSZXF1ZXN0Mjc0MTkyNjM=,1326,Fix for MockWebServer on Android,bf4dacde2594b015519340cebc10665979227530,1,
MDExOlB1bGxSZXF1ZXN0Mjc0NzQ4MTc=,1332,Update http default cache codes,6ea1374a21358e2de21a8cb028a791425bf08dfa,3,
MDExOlB1bGxSZXF1ZXN0Mjc3Nzg4ODc=,1341,Trivial optimization for comparing ConnectionSpecs,e05390f8c6d1a6715a1f87948312113dc091af52,1,
MDExOlB1bGxSZXF1ZXN0Mjc5NDA2MzE=,1348,Reduce flakiness and document reasons for flakiness,851c29d7c69a3b62dccfe6db21c06c8027f6222c,3,
MDExOlB1bGxSZXF1ZXN0MjgzNjM4NzM=,1353,Fix a major bug where threads weren't being created.,50c073c7fa2d1a5718927b19c51370431f6d3178,2,
MDExOlB1bGxSZXF1ZXN0MjgzODMyNTE=,1355,Send at most one condition.,73bf32e4326f2a5ce9a38d4f4345f4ccab3e3cc6,4,
MDExOlB1bGxSZXF1ZXN0Mjg0MjIxODA=,1357,Do not allow timeouts less than 1ms.,fd360482126fcd1f52832d9ea8c2a19c044085fb,2,
MDExOlB1bGxSZXF1ZXN0Mjg5ODAzMzY=,1383,"Throw SSLPeerUnverifiedException when host verification fails, instead of IOException",b0e0be8488c164f61283121b99260817696beab1,1,
MDExOlB1bGxSZXF1ZXN0MjkwODEyMzQ=,1388,Move TLS retries / fallback into Connection.,b614dad6a9f366ea36a5409fae1e014480a67a4d,22,
MDExOlB1bGxSZXF1ZXN0MjkxMjYyNDc=,1391,Add Gradle download info to project Pages,8e0a906efab9d7cffef186c94a254b101352cca9,1,
MDExOlB1bGxSZXF1ZXN0MjkxNTA3NDE=,1393,A way to catch that cleartext HTTP request was attempted.,81e109cfa6d0387dab1c097888ac7b6eac3b5765,2,
MDExOlB1bGxSZXF1ZXN0MjkxNjUxMDQ=,1394,Fix for SslContextBuilder/MockWebServer disagreeing about localhost,5a4aa590b1b0d48aeb42066bb6b7b9b644d82ebb,1,
MDExOlB1bGxSZXF1ZXN0Mjk3Nzg2OTY=,1448,Use Okio's new APIs for number parsing and formatting.,3b52cb61bd763a33872d71312d5b84872728c669,7,
MDExOlB1bGxSZXF1ZXN0Mjk3ODM0MjQ=,1449,Compute the content length of multipart bodies.,ed21dd71211ddab9ccb5e7c482faa3e54da85908,2,
MDExOlB1bGxSZXF1ZXN0Mjk3ODU0NDY=,1450,Fail properly when a port is out of range.,df7a89cf770ba85c0aba1160dcdac6e0284552f5,2,
MDExOlB1bGxSZXF1ZXN0Mjk5Mjk3MDE=,1456,Test that DELETE can have a body.,ae1da7c7d2a0dfe68f275c2da3121ade3273f78d,1,
MDExOlB1bGxSZXF1ZXN0MzA0MDg1MzU=,1465,Payload length continuations are unsigned values.,187820d775d90971e42b7b104f9586387056df58,5,
MDExOlB1bGxSZXF1ZXN0MzA2MTQ4ODA=,1469,null out Request.Builder.url when setting urlString,b11f2f8c4c9a6ea4910b10db69402af63eaa78a4,2,
MDExOlB1bGxSZXF1ZXN0MzA3MDg2NDU=,1472,Don't crash on shutdown() before start().,0c686e94c01ea86f80789f10828ce5a36dfd9021,2,
MDExOlB1bGxSZXF1ZXN0MzA3MTQ0NzE=,1473,Normalize web socket exception messages to match.,f5c69090a05bb3b268d79121981fd503af3246e7,4,
MDExOlB1bGxSZXF1ZXN0MzA3Mjk0MTc=,1475,Drop some RC4 cipher suites.,c96eb865eea9d52f5ade2f62aa9d1d817c8dd453,1,
MDExOlB1bGxSZXF1ZXN0MzA5MTMwMzA=,1487,Provide context on unexpected EOFs.,1002a33dc3451e1648fd903308c4e195f1bf952c,1,
MDExOlB1bGxSZXF1ZXN0MzA5NTI5NTg=,1488,Updates to http/2 final,d26a4cdd681070f18630d14bcade2bdc842ba316,18,
MDExOlB1bGxSZXF1ZXN0MzA5NTk4OTc=,1489,Move WebSocket to the public API in a sibling module.,7e919c155163e73e0abd161269c072962b5859f0,22,
MDExOlB1bGxSZXF1ZXN0MzExODg1MTk=,1495,New file system abstraction.,10784c2698b6f4b2ba14b2209f2aba6bb06b3367,6,
MDExOlB1bGxSZXF1ZXN0MzExOTE1MDU=,1497,Don't get corrupted when journal writing fails.,133e0af57513a47d72f35504fed6cf14c90c0ddb,4,
MDExOlB1bGxSZXF1ZXN0MzEyMDM5MDc=,1501,Add a test for interceptors throwing unchecked exceptions.,36fd34d1b733a26d3101f7466729462150722f57,1,
MDExOlB1bGxSZXF1ZXN0MzEyMDQ0MjM=,1503,Fix a flaky test by waiting until the Okio watchdog is caught up.,60a910f85dcc8330d7526059bab1d99c9f8c5d12,1,
MDExOlB1bGxSZXF1ZXN0MzEyMDkzMTg=,1507,Use Okio when reading cached certificates.,927f2279d5815b33e155b9c0014a8948e49093db,1,
MDExOlB1bGxSZXF1ZXN0MzEyMTI3NTM=,1508,Fix some crawler bugs.,5edea761d4fbf5da428708222fc50610f3afd4d9,1,
MDExOlB1bGxSZXF1ZXN0MzMyMTE3ODQ=,1553,Expose running and queued call counts for monitoring,72d7853c6a56154b7bab4531b6fe5237c3d29957,1,
MDExOlB1bGxSZXF1ZXN0MzMzOTI0MzY=,1559,Never convert null into an empty request body.,945da7a06156f584bd9034f866facc7b5aeba0f7,5,
MDExOlB1bGxSZXF1ZXN0MzM2MTIzNzg=,1570,Don't get stuck waiting on the connection window.,e4ed43207eb74ec7d041fb0db2c97953f8d80626,3,
MDExOlB1bGxSZXF1ZXN0MzM2MjU2Njk=,1571,Update reader state on the reader thread.,5185c357f386222e0c94feb94861f7caab6e45cf,2,
MDExOlB1bGxSZXF1ZXN0MzM2OTMwMjk=,1575,"Do not rebuffer socket streams for web sockets, other fixes.",2bfbf2945c4a53d2fb0a467436f1af578acee24d,9,
MDExOlB1bGxSZXF1ZXN0MzM4MjM3ODM=,1578,HttpUrl initial API.,4be3569f238ec3a448c605ce73c069820f4b83ad,1,
MDExOlB1bGxSZXF1ZXN0MzQ2MTEyNTA=,1601,HttpURL parsing.,d95dad278080b8efa4c25a80dab3e76f05995891,5,
MDExOlB1bGxSZXF1ZXN0MzQ2MTU2NzY=,1602,Implement percent encoding.,4ec0fe352c4a3cce697d4f9ef47a79cea45de559,3,
MDExOlB1bGxSZXF1ZXN0MzUwNjk4MDU=,1619,Compose URLs from parts.,5150402d785575666709e9bf6834b5c66539a6a6,2,
