id,number,title,mergeCommit,changedFiles,changedPackages
MDExOlB1bGxSZXF1ZXN0MTg2MzIxMA==,1,Initial import.,f56cbd22368ad4b5d6652f29647d63fc2ea08f40,63,
MDExOlB1bGxSZXF1ZXN0MTg2MzM3OQ==,2,Give the in-progress code a SNAPSHOT version number.,37de950ccc0342a2e776b23207d1f0a41c4e1173,1,
MDExOlB1bGxSZXF1ZXN0MTg2MzcwOA==,3,Enforce javac version 1.7 or better.,7f84db4a4679b71a0f8b2bc500570a3d9d90c851,1,
MDExOlB1bGxSZXF1ZXN0MTg2NDg0Mw==,4,Don't connect to external hosts in unit tests.,57cb8a8813d97242617497afd30e7711a599a51a,1,
MDExOlB1bGxSZXF1ZXN0MTg2NDkxNg==,5,Don't sign artifacts in the default configuration.,a08e68150d8f3552c6bc1a3fa4feb475a34d4b27,1,
MDExOlB1bGxSZXF1ZXN0MTg2ODcwMA==,6,Use Square's regular groupId for okhttp.,9c9ae224e1b17d62e64b644d8f923c59135864af,1,
MDExOlB1bGxSZXF1ZXN0MTg2ODkyNw==,7,Remove duplicate plugin definitions.,10dc1c1f8bf602286539bd1f4358be6bec64f103,1,
MDExOlB1bGxSZXF1ZXN0MTg4MTk4Ng==,8,Don't use jarjar to strip unused classes.,cb63e3b86c015ca2e06bd0ea5c72d82e2efe73b7,1,
MDExOlB1bGxSZXF1ZXN0MTkxNDM0MQ==,9,General project clean-up and tweaks.,67c6551470f412cf37b3344f89b38211ad4fc01b,30,
MDExOlB1bGxSZXF1ZXN0MTk0NzE5NQ==,10,Use bouncy castle to generate certs for TLS.,f45cb10b82aa9127bb14996ad75c77cb910cb42f,3,
MDExOlB1bGxSZXF1ZXN0MTk0ODM1Mg==,11,Uncomment more HTTPS tests.,67f3df36b64276a66c2e63891bcfa2351cabc975,5,
MDExOlB1bGxSZXF1ZXN0MTk1MTcxOQ==,12,Support Froyo.,c5b71332197188acccabdd151ad64f8e66b598dd,17,
MDExOlB1bGxSZXF1ZXN0MTk2MDg3Mw==,13,Fill out known issues in the OkHttp README.,9e2874637c930aa17e3e2b885036720e0900b2c1,3,
MDExOlB1bGxSZXF1ZXN0MjAxOTE3Mg==,14,Add a missing copyright header for Libcore.,4c1b39b7fdda5083d76cebb3a707d3460510d95e,1,
MDExOlB1bGxSZXF1ZXN0MjA2ODkzMw==,16,Fail gracefully on a 401 response code with no WWW-Authenticate header.,1096674780a087ec99d254d7e4661503eeeb85cb,2,
MDExOlB1bGxSZXF1ZXN0MjM5MTU0Mg==,20,Merge: HttpEngine should not attempt to cache proxy CONNECT responses,c464819c97debe7f78bab2228c1d760a88f38cb5,2,
MDExOlB1bGxSZXF1ZXN0MjM5MTYzMQ==,21,Merge: Improve HttpResponseCache performance.,87c0475b8581a98f5dd677cdf290a3549d11adf5,1,
MDExOlB1bGxSZXF1ZXN0MjM5MTc0MQ==,22,Merge: TLS + SNI + proxy => bug,c1d2039ea2a5eaf6b69c99f63f6cb1f9f12bf459,2,
MDExOlB1bGxSZXF1ZXN0MjM5MTk3NQ==,23,Merge: Tolerate cache files being removed from underneath DiskLruCache,ca06e71538432be2779a738b53f6860677477b72,3,
MDExOlB1bGxSZXF1ZXN0MjM5MjE4Ng==,24,Merge: Fix HttpURLConnection CloseGuard warning due to lack of close on ...,0417d1de1a95399ca37bf5c033c64469943f28dc,2,
MDExOlB1bGxSZXF1ZXN0MjM5MjUwMQ==,25,"Merge: HttpResponseCache should return 504, not 502.",aa1f539162755147c74beec9b160b0adfa66479e,2,
MDExOlB1bGxSZXF1ZXN0MjM5MjkxMQ==,26,"Merge: Performance improvements: DiskLruCache, HttpResponseCache.",19dd3d4c534b21a05932d34ae99f3170fffd1bc9,4,
MDExOlB1bGxSZXF1ZXN0MjM5MzAzMQ==,27,Disable SSL compression,cfaab5253d56893ae244504fc2d73f5fa103ffee,1,
MDExOlB1bGxSZXF1ZXN0MjM5NDIxOA==,28,Fix checkstyle errors.,1fba5d9248de55062e9671c5398baef7509a9f8b,2,
MDExOlB1bGxSZXF1ZXN0MjQwNDkzNg==,29,Fix TLS requiresTunnel which was being computed incorrectly.,d600c3f7506882b063a3ae5ad513b324b3354592,6,
MDExOlB1bGxSZXF1ZXN0MjQwNTU3MQ==,30,Fix a bug in tunnel construction and 'Connection: close' headers.,8e2d479306a8ab2e7054c3c7d6d778ee79c392ac,2,
MDExOlB1bGxSZXF1ZXN0MjQwNzg5Ng==,31,Fix Authenticator callbacks to include full information.,1608590380284c952eae12f43c400f9d1922b6c7,2,
MDExOlB1bGxSZXF1ZXN0MjQxODY0MA==,33,Handle incoming SETTINGS frames in SPDY.,c4fe0cc84a7a06b8b63f060b23a30ecaf6e3eed3,6,
MDExOlB1bGxSZXF1ZXN0MjQzOTA4OQ==,34,Fix a bug where String.substring() parameters were flipped.,f740fa986ee023405aa65798931037d78e004ecf,2,
MDExOlB1bGxSZXF1ZXN0MjQzOTA5NA==,35,Implement TYPE_PING.,bee97794d09d0deca0e0fe352565457e3a2951f2,6,
MDExOlB1bGxSZXF1ZXN0MjQ0NTM0Mw==,36,We don't need no stinkin braces.,141e1d2a6573b3800b9a61b14e3dfcf33de6f2c1,1,
MDExOlB1bGxSZXF1ZXN0MjQ0NzI3Nw==,37,Be more careful about synchronization.,0be8f011ca907a1494cde0aa4569dd2f0667071d,3,
MDExOlB1bGxSZXF1ZXN0MjQ0OTg4Nw==,38,Address some todos around stream failures and peer errors.,197397458640b6dc1c1510539d1cfd61d0062919,4,
MDExOlB1bGxSZXF1ZXN0MjQ1ODk3NQ==,39,Abandon foolish consistency with SpdyReader for sending frames.,2f3bbf673593cc84cdd9af898b69458ff3e6d9f2,7,
MDExOlB1bGxSZXF1ZXN0MjQ2MTEzMg==,40,Missed my period.,ccbd6996dc1584e59845b08906c5f8065e398e63,1,
MDExOlB1bGxSZXF1ZXN0MjQ3MzA1NQ==,42,Support reply with fin for no response body.,cd86079b4cce5e281debb1ce4d18c0bef400a7f3,5,
MDExOlB1bGxSZXF1ZXN0MjQ4NTEwOQ==,43,Be strict and careful when parsing the response status line.,6764bbc5aaaffe0633981c301ba2790669bdf3cd,8,
MDExOlB1bGxSZXF1ZXN0MjQ5MzExNA==,44,Support noop frames. Make ping sending a blocking (synchronous) call.,eca502c4f95dab19c7947e2dd2ae1917a5b3f8fb,4,
MDExOlB1bGxSZXF1ZXN0MjQ5NTY2Ng==,45,Use callbacks rather than fields to handle incoming frames.,74993430a1e4a69247199db85229baf4d6fc8b24,4,
MDExOlB1bGxSZXF1ZXN0MjUyMjUzNg==,46,Tests and code for various SPDY close scenarios.,8a825777e0a4fafaf8c0f457ecb1ca5862e408c5,4,
MDExOlB1bGxSZXF1ZXN0Mjc2NjY2MQ==,47,Fix a severe bug where multiple TLS tunnels were attempted.,41cafe67db383688a77662c15b380011ffca77cd,2,
MDExOlB1bGxSZXF1ZXN0Mjc3NDM4Mw==,48,Fix connection recycling for TLS+gzip+chunked.,dc836ca006e4358df9f5cb34667ae8cc3c2842c9,4,
MDExOlB1bGxSZXF1ZXN0Mjg5MzEwOA==,49,Make HttpConnection.connect return full working connections.,ddd1500ba7f6d22a4887762beed6e2a5f0086230,12,
MDExOlB1bGxSZXF1ZXN0MjkyMDk3Mg==,52,Fix some bugs from exercising HttpConnection + SPDY.,bc565d6750331d64935577925aacbece8567d09d,3,
MDExOlB1bGxSZXF1ZXN0Mjk1NjI0NQ==,53,New route selector to support multiple routes.,d676196982b42bcbf421991866fa2563d6e6191d,10,
MDExOlB1bGxSZXF1ZXN0Mjk1OTM0MQ==,54,Don't drop out of connect if the first request fails.,f76ba8d0e9f63745f2bf5db41df925f9a220edcd,2,
MDExOlB1bGxSZXF1ZXN0Mjk3MTMxMw==,55,Don't explode if DNS fails or if the address is malformed.,34cdece96c90547f98250464a05370a862fb31ac,2,
MDExOlB1bGxSZXF1ZXN0Mjk4MDA5Mw==,56,New API to break platform-specific dependencies.,3b5e87cce2e4029eb4662eb4610fe21fcdea1a80,6,
MDExOlB1bGxSZXF1ZXN0MzIxMjg3Nw==,58,Fix checkstyle issues.,d029f2222a38a0d877e6ed30d1cdef3f6301f4cf,2,
MDExOlB1bGxSZXF1ZXN0MzI3MzgzOQ==,59,Improve connection reuse.,66e27c743bde31fa943394733a407a39a343b5f1,3,
MDExOlB1bGxSZXF1ZXN0MzQwMzQ4Mw==,60,Prepare to use OkHttp to back HttpURLConnection in AOSP,798d82dbec7fbcf45ffa8b8b674ce4bd7bd2bd7c,77,
MDExOlB1bGxSZXF1ZXN0MzQ2MTgzMQ==,61,Move system-wide statics to the OkHttpClient class.,23f72ec1d7611034317ee7efb8a709c6fb4a24df,10,
MDExOlB1bGxSZXF1ZXN0MzQ2NTQ1Mw==,62,Clean up commented out URLConnection tests.,58aa6bd231842204bd85cae569b034017a276f3b,2,
MDExOlB1bGxSZXF1ZXN0MzQ2OTM0NQ==,63,Move the SSL socket factory and hostname verifier to the client.,368dd590a17a3eef8b6c7cced39cf913a42fea1f,2,
MDExOlB1bGxSZXF1ZXN0MzQ2OTQ1NQ==,64,Restore tests for response caching + TLS.,a379fffa518e9ceb20e9e0d6dfe01f5f3de5c06f,4,
MDExOlB1bGxSZXF1ZXN0MzQ3MDAxOA==,65,Prepare to promote HttpConnection + Pool to public API.,fac7594e45221d4c2a5185ba07cc68a5ecbbf761,7,
MDExOlB1bGxSZXF1ZXN0MzQ3MjQ1Mw==,66,"Promote Connection, ConnectionPool and Address APIs.",c8c231309a1af3e176b91e721f75a37bafeddbde,16,
MDExOlB1bGxSZXF1ZXN0MzQ4NDY0NA==,67,Clean up utility code for submission to AOSP.,381b3c7bcbb1d903a5941eaf40b5ac43f984648c,25,
MDExOlB1bGxSZXF1ZXN0MzUwNjg2MQ==,69,Unsuppress tests and upgrade to JUnit 4.,de5b3ac703cf4040d966508e0fb06411d2f1ccc9,18,
MDExOlB1bGxSZXF1ZXN0MzUwNzIwMw==,70,Fix synchronization todos in SpdyStream.,0028e0e75fd6f0474f0f4f3355e11d46e082955e,4,
MDExOlB1bGxSZXF1ZXN0MzUwODEzMg==,71,Improve SPDY error handling and concurrency.,2d698fe1c398c395259663e7a940cae549fdbeb3,5,
MDExOlB1bGxSZXF1ZXN0MzUxMTE4Mg==,72,"Implement GOAWAY, for clean shutdowns of SPDY connections.",5956645d686b958395f293e0ef507830ced67ac1,9,
MDExOlB1bGxSZXF1ZXN0MzUxNTQxMA==,73,Discard streams once they're no longer open.,72c5a9a57c2e81f35bd438ecdcced6b8ce40d82b,3,
MDExOlB1bGxSZXF1ZXN0MzUxNTU1MQ==,74,Implement SpdyConnection.close().,6f9ccd42f895f8d625667090891782c856227a29,6,
MDExOlB1bGxSZXF1ZXN0MzUxNTc5Mg==,75,Make timeouts work for SPDY.,434e2c7f5249e8573a1a9f9895a030df1083da2c,5,
MDExOlB1bGxSZXF1ZXN0MzUxNjU5OA==,76,Use TLS + NPN in SpdyServer.,d36d50d64a0b6b5ec7c41a09d19dcf804cb618c9,1,
MDExOlB1bGxSZXF1ZXN0MzUxNzc2Ng==,77,Support the HEADERS frame.,ef7586475f3da036beb18c3a1dc21038660a8a0e,6,
MDExOlB1bGxSZXF1ZXN0MzUxNzg0OA==,78,Flatten internal packages and utility classes.,acd4cd65da4c985e092f35b9c3776af511adb12b,49,
MDExOlB1bGxSZXF1ZXN0MzUzODQyNA==,79,Turn  makeTlsTolerant into two methods.,4ce7919cd298617a76ddde8f3725e42f2b15f230,3,
MDExOlB1bGxSZXF1ZXN0MzU2MzU3OQ==,80,Upgrade from spdy/2 to spdy/3.,e45561822096267268c1fb14ab328cd6e4fa080e,14,
MDExOlB1bGxSZXF1ZXN0Mzc0Mjc0Mw==,84,Implement flow control for the incoming stream.,780466a82ba5bb86389f2819b50de83b6ce537a5,6,
MDExOlB1bGxSZXF1ZXN0Mzc0NTcyMw==,85,Implement flow control for the outgoing stream.,c25c296aade67d739f5bff19c6449a144e2a319d,6,
MDExOlB1bGxSZXF1ZXN0Mzc1MTkwMg==,86,Be more careful around IOExceptions.,59992d0291eab328173bcbd2757a541d36eea1b8,8,
MDExOlB1bGxSZXF1ZXN0Mzc4MjM3Ng==,87,Introduce MockSpdyServer.,a3ddc2c9997bdcc1c0604598b0efbeb646d59c7f,5,
MDExOlB1bGxSZXF1ZXN0Mzc4ODg1NQ==,88,Improve SPDY+HTTP integration.,fc24b7dfb6fc28ad7579f0ac56e094f1f1280264,17,
MDExOlB1bGxSZXF1ZXN0MzgwMzcwMA==,89,Fix cookies for SPDY transport.,6488ceb955788f83b39717356ab4c630f927a290,5,
MDExOlB1bGxSZXF1ZXN0MzkyMTE3Mw==,91,Retry if a request fails after a redirect.,5e6432c2e21f50cbf04be80127380407940942c9,2,
MDExOlB1bGxSZXF1ZXN0MzkyMTIwNw==,92,Mark a racy test with @Ignore.,1bce6a64e19782d47f6cd204612a238755560308,1,
MDExOlB1bGxSZXF1ZXN0MzkyMTQ4MA==,93,Follow up to 20 redirects.,99922772fe3b726d5d7cb3b2d831b07cbd9561db,2,
MDExOlB1bGxSZXF1ZXN0MzkzNDE4OA==,94,Improvements to connection pool,ee13f91352f8e661941e4d3b9214a6210e67aa3a,7,
MDExOlB1bGxSZXF1ZXN0MzkzNzA3Nw==,96,Mechanically change OkHttp to Square's Java style.,8a5731cecf0865d7a6168199edef521d16444a00,56,
MDExOlB1bGxSZXF1ZXN0MzkzODEzNg==,98,Update checkstyle.xml and fix problems,e86fe8a7fea20442f1bd39f864fcf7f2fb425e3e,7,
MDExOlB1bGxSZXF1ZXN0Mzk0Nzk2OA==,99,"Merge: Strip content length in requests with ""transparent"" gzip handling",d6364a20b660ae3a5a1715f9645a9aaaffb19f48,3,
MDExOlB1bGxSZXF1ZXN0Mzk0OTA1Mg==,100,Increase the stream drain timeout from 30ms to 100ms.,f6aca66309804fdb1b3a8cec4c2e48c834f59dfb,2,
MDExOlB1bGxSZXF1ZXN0Mzk0OTIwOQ==,101,Switch to Square style for comments.,76aa883be0cd1430e0f35273fca76c4d5b50c7dc,14,
MDExOlB1bGxSZXF1ZXN0Mzk1MzM4Mw==,102,increased version to 1.0,c07921282cb089cb581399ad265e5a582a55c3c5,1,
MDExOlB1bGxSZXF1ZXN0Mzk2MDMzMw==,103,Don't make the 'proxy' field do double-duty.,b2b891d366e63602465f0ff31d24f4cd909d3db5,3,
MDExOlB1bGxSZXF1ZXN0Mzk5NzUyOQ==,107,Handle http status message without leading space when the message is emp...,93da535e02e6320dad4f313bf618381226143fe3,2,
MDExOlB1bGxSZXF1ZXN0NDE0NzI0Ng==,117,Use LinkedList.listIterator instead of LinkedList.descendingIterator() f...,cd68193249246b45e69614eb96ff515f861e91ea,1,
MDExOlB1bGxSZXF1ZXN0NDE1MTM5Ng==,118,Share thread executors in SpdyConnections,98e97fbf869648b17a48194a7e44553b9bbe0064,5,
MDExOlB1bGxSZXF1ZXN0NDE4MzY2Mw==,119,Fix checkstyle errors,4458b47baf82e7547afaa96422f25ce53a961ef2,1,
MDExOlB1bGxSZXF1ZXN0NDE4Nzc2Ng==,120,Optionally follow redirects from HTTPS to HTTP and vice versa.,605002ab8090ea7a113a3985f8d15fb8e8f60a92,5,
MDExOlB1bGxSZXF1ZXN0NDIzMzQ4MQ==,121,Fix a null pointer exception in SpdyTransport#makeReusable,a907139e3ef1ae3021a7dd7197d7a7a3149c109f,1,
MDExOlB1bGxSZXF1ZXN0NDI0ODU1OA==,122,Add new synthetic header for determining response source.,39334a26e86ba2d9adbe52d2dc0dd74c5fd8c3bd,3,
MDExOlB1bGxSZXF1ZXN0NDI0ODYxMQ==,123,Ensure we test the correct connection instance.,8655a76174e756a59a81676a7646ea53af141bac,1,
MDExOlB1bGxSZXF1ZXN0NDM0MzUwMg==,124,Add evictAll method to connection pool.,86b2f5a3f8916519dcc2ce14c021deab50eeae75,2,
MDExOlB1bGxSZXF1ZXN0NDM1NTQ4Ng==,125,Add support for following HTTP 307 temporary redirects.,12ab70c3e89fc004d0365ed205beaa2b8b869173,2,
MDExOlB1bGxSZXF1ZXN0NDM2Mjc5MA==,126,Fix froyo bug: no more descendingIterator,3adee2fe98f1b30691d111f009dd77d7c6facb8e,1,
MDExOlB1bGxSZXF1ZXN0NDU3NDA3Mw==,127,Guard against invalid name value block headers.,842b248165b318354ba05ea9c58c03f7bffd10cb,1,
MDExOlB1bGxSZXF1ZXN0NDgwODk5Nw==,129,Move library into a module. Introduce sample module with simple GitHub c...,45041b84841173035564052483e78554be81e6a8,62,
MDExOlB1bGxSZXF1ZXN0NDgxMDE4NQ==,130,Add Apache HttpClient implementation which maps to OkHttp.,0263e4c3a2a45c145ee1c99e46d9f7efcd7d9e35,3,
MDExOlB1bGxSZXF1ZXN0NDg0NzU2Mg==,132,Provide a non-internal API to the response cache.,68f00e1c84f444009a8299db638967fd3b3fb659,10,
MDExOlB1bGxSZXF1ZXN0NDg5ODc1OQ==,133,Tidy the public API for HttpResponseCache.,a6df275bf0590770e116ca0176f350b1bb96e1d3,9,
MDExOlB1bGxSZXF1ZXN0NDg5OTEwNw==,134,Use the latest DiskLruCache in OkHttp.,4b9165d9b6f71e43f7519d36d06f35069b4d8e6d,2,
MDExOlB1bGxSZXF1ZXN0NDg5OTMwNA==,135,Track DiskLruCache.flush change.,63c2317f6c3fee90e63b85e9c6d9e4e4fb9c3be1,1,
MDExOlB1bGxSZXF1ZXN0NDkwMjUwNA==,136,Don't use APIs that Froyo doesn't have.,da8482cabadd7059c4ebd2fc2596da5f98ac5644,7,
MDExOlB1bGxSZXF1ZXN0NTA0MDYyMg==,138,FaultRecoveringOutputStream.,5e6c5981d214bfd653c4cb76adb0447a5a80a4fb,2,
MDExOlB1bGxSZXF1ZXN0NTA2MTQ2MA==,140,Allow empty header values,7672bf6b1d672c800e6f022c8ddd397509f55140,1,
MDExOlB1bGxSZXF1ZXN0NTA2Njc0MA==,141,Be more strict about outgoing request headers.,745cd24a5daf9e1e5923885e65d689f18ecf6efe,3,
MDExOlB1bGxSZXF1ZXN0NTA4ODY1MA==,142,RouteSelector tries previously failed routes last #106,6e03a92eac300ac55b0f0fb8653a5270a6399091,10,
MDExOlB1bGxSZXF1ZXN0NTA5NTc1OQ==,143,Fixed copyrights,1fcb75ef44f882858c9d05204b3b121f4f2cd2ac,2,
MDExOlB1bGxSZXF1ZXN0NTA5NTg1Nw==,144,Restore Apache copyright header to ConnectionPool.,dfa542b6c0eeec9c67a891ca8af24e751116ec43,1,
MDExOlB1bGxSZXF1ZXN0NTExODk1MQ==,146,Synchronize access to idleStartTimeNs.,aa32add30311cd08a7df6aa240bcfa60942e5103,1,
MDExOlB1bGxSZXF1ZXN0NTE2MjcxOQ==,147,Fix style,1415ae9fda41d9d07d8cc6e3804cb8b9480fd5cc,1,
MDExOlB1bGxSZXF1ZXN0NTE3MzY5Ng==,148,Update to the latest DiskLruCache.,a64baf22d26410c25662bfcd9ee4adce164cc3a5,2,
MDExOlB1bGxSZXF1ZXN0NTIwMzQxMA==,150,Recover from failed flushes and closes too.,190ee8fd8a1706418b69b3c25c326b3fc7b83205,2,
MDExOlB1bGxSZXF1ZXN0NTI4MzQ0NA==,152,Use an MTU-sized buffer for socket access.,4fdc3f0e2ff555cf126582f067c4ab47cc421cdd,3,
MDExOlB1bGxSZXF1ZXN0NTI5MTY3NQ==,153,Recover from failures while writing a POST body.,ea03097d1e95ab584b8fe6b1ac671ae0f92bb590,6,
MDExOlB1bGxSZXF1ZXN0NTQwOTk2Nw==,155,Non-static authenticators.,4ca42e0031085a8ea5c7d172386467ddac9d5d6b,11,
MDExOlB1bGxSZXF1ZXN0NTQxNzI1Nw==,156,Permit the caller to disable transports.,b56a22e2f5fdc9c9ebd0804efc9abf8471462a01,9,
MDExOlB1bGxSZXF1ZXN0NTQzNTQ5Nw==,157,Don't explode if we can't find an interface for a local address.,e9842cb2e6b025743c83b32b40be460738073ecc,1,
MDExOlB1bGxSZXF1ZXN0NTQ1NTQwNg==,158,Fix checkstyle.,e5096c52220947d859a47d8a59ec004b75f8acfb,1,
MDExOlB1bGxSZXF1ZXN0NTUzMDA0MA==,159,Updates to readme.,b7fa4a976fa9138320911c295f9b95fe75497232,1,
MDExOlB1bGxSZXF1ZXN0NTUzMDA1Ng==,160,Minor doc fix.,c31f3aa6022eb59157cad223dc83fa25df1a7861,1,
MDExOlB1bGxSZXF1ZXN0NTUzMDA4OQ==,161,Give the Apache module its own readme.,c74cb75e28fba47c706f396814182510b6ed453a,1,
MDExOlB1bGxSZXF1ZXN0NTUzMTUzMA==,162,Include a hostname verifier rather than using the system default.,d0004f2067a951295d45b7b9b6f981f67264e8f2,5,
MDExOlB1bGxSZXF1ZXN0NTUzMzEzNQ==,165,Dependency-free examples for the OkHttp front page.,beeb48f2f655a185b8ebb2ed592cd97f843e25bd,5,
MDExOlB1bGxSZXF1ZXN0NTUzNDY1Nw==,166,Pom version updates. Drop unused dependencies.,5fa7dac5efc52386b06abe9da7e327a5850779eb,1,
MDExOlB1bGxSZXF1ZXN0NTUzNTYyMQ==,168,Use daemon threads in the connection pool.,ca67ac4717105e8041b70d56bdb5a16089b6165d,4,
MDExOlB1bGxSZXF1ZXN0NTUzNjM5OQ==,169,Use the latest mockwebserver,9b7c8409b68827b6d57c89ff32755a533041ad39,1,
MDExOlB1bGxSZXF1ZXN0NTU0MDAxNQ==,170,Consistent casing of 'SSL' in method names.,0796c533540ff839bae26f21eb4ae56fc1cda475,2,
MDExOlB1bGxSZXF1ZXN0NTU0ODM2MA==,172,Jw/casing,07225fb9c2ee4f25e5605a2f65ec4987e3540a69,5,
MDExOlB1bGxSZXF1ZXN0NTU1ODU3Nw==,174,Add some tests for the Apache wrapper.,3b28a3bfc0d2ee86c33f4731de541fd040d0f2b5,2,
MDExOlB1bGxSZXF1ZXN0NTU2MTY0NQ==,176,Link to the new OkHttp website.,72f03678af718635b9c9486d7a66b7188c649377,1,
MDExOlB1bGxSZXF1ZXN0NTU3MjAyNQ==,178,Hide internal from Javadocs,7f166a355516eadc34ba63451e1306d0dd228ce9,1,
MDExOlB1bGxSZXF1ZXN0NTY0MTgxMw==,185,Clamp the MTU to a reasonable range.,cb471fc0954fb185b21550f2b3d3760b22af6e31,1,
MDExOlB1bGxSZXF1ZXN0NTY0Mzc4OA==,186,Replace String.isEmpty() calls with Java 5 methods,d4147143692632e65d2ea76c8dc1122d11cbe2e6,1,
MDExOlB1bGxSZXF1ZXN0NTY1NTM2Nw==,188,Don't explode if NetworkInterface.getByInetAddress does.,dd354adf6ff4ca1a6a036ad96b689640c8c3b2c5,1,
MDExOlB1bGxSZXF1ZXN0NTgyMzgwMg==,192,Add an implementation of URLStreamHandlerFactory,cc2e0dd70417d923e2bb38feba3c2a5b46f69ce0,2,
MDExOlB1bGxSZXF1ZXN0NTg1MTYyMw==,194,Use animal-sniffer to ensure only Java 1.5 is used,c9e9d45649a2e537cd4a5b60ba7f68a7dc63d940,1,
MDExOlB1bGxSZXF1ZXN0NTkzMDExMA==,197,Correct specialized platform name to Java6.,de26790eafc01e49bbc09760dd9c13a345ec39d9,1,
MDExOlB1bGxSZXF1ZXN0NTk1MjA2MQ==,199,Null-check request entity since it might not be present.,aa4f4484c929f3b0fea65a16695fad7c905441c5,2,
MDExOlB1bGxSZXF1ZXN0NTk5NjI4OA==,201,Add new classname for AOSP's SSLSocket change,489956e40f66d57a2373653b71f03d27078e45f6,1,
MDExOlB1bGxSZXF1ZXN0NjA4MzE1MQ==,204,Support querying & setting transport lists on connections.,6baecd2dc500700793b01d5d0ec5807f760eb8a8,6,
MDExOlB1bGxSZXF1ZXN0NjI2Njc4MQ==,208,Allow access to the underlying DiskLruCache.,cc421b7fe70f5dc5fc2c8091583f69792b102ae1,1,
MDExOlB1bGxSZXF1ZXN0NjMwMzE0Mg==,209,Ignore null header values.,61112416157f3fe3972a685e8826f6dca1cfd287,1,
MDExOlB1bGxSZXF1ZXN0NjMyNTA4NQ==,210, Fix bad locking in SpdyConnection,5ec31ddb792a2c00882bbdb0a6dd60c549a6e6bc,1,
MDExOlB1bGxSZXF1ZXN0NjM0MjY2OQ==,211,Make OkHostnameVerifier a constant. This fixes connection reuse.,803852d9ab5a0ac8084ab206810f6e7d15ae65de,3,
MDExOlB1bGxSZXF1ZXN0NjM0MjY5NA==,212,Don't whitelist routes when recycling them,500d26e00789820600b0d2bb2f6eec90a1c1d91a,1,
MDExOlB1bGxSZXF1ZXN0NjM0Mjc4OA==,213,Tweak the API for URLStreamHandlerFactory,e63afed0a488541be447c07ec0e62eb036d7800e,2,
MDExOlB1bGxSZXF1ZXN0NjQ5MzY4MA==,217,Fix a bug in caching cross-protocol redirects.,57af28db8ae71fd6384a6f8ac3f5dee1c78f21a6,3,
MDExOlB1bGxSZXF1ZXN0NjQ5Mzk2OA==,218,Make ConnectionPoolTest less flaky,a902367cd34018caed0c89dbcd51c36c52bbb428,1,
MDExOlB1bGxSZXF1ZXN0NjY2MTk5Nw==,225,First step in an async HTTP API.,9aa4132295080b5380e8499b5e94b770475dfb42,10,
MDExOlB1bGxSZXF1ZXN0NjcyMTQxNA==,231,Allow specifying default timeouts for connect and read per OkHttpClient.,22c82abec408616558352198d4ffe23702b85c95,1,
MDExOlB1bGxSZXF1ZXN0NjcyMTc4MA==,232,Request entity tests for the Apache client shim.,af80aff05298ca3b2e56dbaf6bd8d01034a3854f,1,
MDExOlB1bGxSZXF1ZXN0NjcyMjI1Nw==,233,Ensure cache entries are invalidated even for uncacheable POST-like requests.,871f6f9a12bccce915458f9d2e4dbd761cf67e66,5,
MDExOlB1bGxSZXF1ZXN0NjcyMjUxNQ==,234,Change custom headers to 'OkHttp-Foo-Bar' format.,887aab98335bc29029153d6e7906e47878ed5c09,2,
MDExOlB1bGxSZXF1ZXN0NjcyMzgwNg==,235,Cache all non-standard date format instances lazily.,d25a3fd297119e88f3827c7012f88a342d3e530d,1,
MDExOlB1bGxSZXF1ZXN0NjczNjA4MA==,236,Add a media type class to OkHttp.,82e5a6ec6d9165eec2bd4ffbbe310cc2049f0836,2,
MDExOlB1bGxSZXF1ZXN0Njc1MTA5MQ==,237,Add factory methods to create request bodies,de60d8f0bac6e03e84b84e97b468e237d2e8509f,4,
MDExOlB1bGxSZXF1ZXN0Njc1NzY3MQ==,238,Support streaming request bodies longer than 2 GiB.,2ae6c84c55c053e81b5e1b393cd945cabb43b89a,5,
MDExOlB1bGxSZXF1ZXN0Njc2ODQxMA==,239,Push state from HttpURLConnectionImpl to OkHttpClient,c14f68ccab656bba345041068d12c15f35feeac6,14,
MDExOlB1bGxSZXF1ZXN0Njc5NzM4Mw==,241,Introduce a Policy interface between engine and connection.,439324544403e76841a524b6202efe4fc2bb902c,12,
MDExOlB1bGxSZXF1ZXN0NjgwMDIxOA==,243,Fixed Alcatel getByInetAddress bug. ,3fcce9ebea4f93dc4379f6d1614548267be1c100,1,
MDExOlB1bGxSZXF1ZXN0Njg2MDIyMQ==,244,Catch SecurityExceptions from socket connects.,3abd07f02ccf6bc356d87d1c46ef805043bb50c9,2,
MDExOlB1bGxSZXF1ZXN0Njg3NTEwNQ==,245,Removed trailing whitespace in Platform.,fd2b555d79fab74fe37b7f05bb9171e714ae54a6,1,
MDExOlB1bGxSZXF1ZXN0Njg3OTgyMg==,246,Stopped sending final empty frame on stream initiated in sender half-closed state.,09edd31432e6d04852b17b9d8d458efa09482394,1,
MDExOlB1bGxSZXF1ZXN0Njg4MzU4OA==,247,Don't use IOException APIs not in Gingerbread,228f4c1432a9c5e94ee31941e8e3b98d3501db40,1,
MDExOlB1bGxSZXF1ZXN0Njg4NDM4OA==,248,Added contentType/Encoding to HttpResponse's Entity.,2b61f591fde2881d1cf9398f0f7a4dee2c2723ea,2,
MDExOlB1bGxSZXF1ZXN0Njg4NDU0Ng==,249,Removed trailing whitespace in website/index.html.,fde0c3b9f40a1651a0aa41227dc68bf6045a9d72,1,
MDExOlB1bGxSZXF1ZXN0Njg4NDk0OQ==,250,Added check for length < 0 for transparent gzip response.,5c1d783dbc6c2c51577fd4fc0da6bc29d519d40b,1,
MDExOlB1bGxSZXF1ZXN0NzA2MDI3Mg==,254,More aggressive heuristics on pooled connections.,a48adf04c17a02f4bd8518869d56632e60befcba,8,
MDExOlB1bGxSZXF1ZXN0NzA2MDU0NQ==,255,Fix a bug in SPDY plus HTTP caching.,52053be291580299018fdc21f1f42e191a972e82,4,
MDExOlB1bGxSZXF1ZXN0NzM3MDYxOA==,261,Make a home for MockWebServer in OkHttp.,58153752b4b60c077513051bc9e5ffc841eb7584,24,
MDExOlB1bGxSZXF1ZXN0NzM3NDMyNg==,263,Import mockwebserver from code.google.com.,7d71bc876c8b5cad607c024258f3f8c5fed92aec,19,
MDExOlB1bGxSZXF1ZXN0NzQwMDg4NQ==,266,Teach MockWebServer SPDY.,ad287139bf9325b081f4a6c98dc6297d4cae2956,12,
MDExOlB1bGxSZXF1ZXN0NzQwMTc4Mw==,267,Use the OkHttp code style in MockWebServer,aa5813e8d839a506c7d1228fa240059263f4c171,6,
MDExOlB1bGxSZXF1ZXN0NzUyMjgxMg==,275,Test gzipped HTTP 304 response bodies,e0fc5292c143940f8e86d17ebd0f9b515ab2c565,1,
MDExOlB1bGxSZXF1ZXN0NzUyMzI4NQ==,276,Prepare for OkHttp 1.2.,a599139e391a6382eb7258e3afcb182132c833de,10,
MDExOlB1bGxSZXF1ZXN0NzUyNzgzMw==,277,Support multiple variants of the SPDY protocol.,99ec6bbc5f1c8d6d7220e0060b0a83401e308255,9,
MDExOlB1bGxSZXF1ZXN0NzU5MTE4Nw==,279,spdy 3 support length 0 header value,592823d13842e2d8080486c5600f08d133defc04,1,
MDExOlB1bGxSZXF1ZXN0NzU5MTc5OA==,280,Push stream flags into Spdy3.,c6abc9f7c1040c531c5be0fa941167e2a7aee12e,9,
MDExOlB1bGxSZXF1ZXN0NzYyMjk2OQ==,283,Hide more flags from SPDY APIs.,6b065f3fe976ef70ae63f774daa8c0209dfff4c6,8,
MDExOlB1bGxSZXF1ZXN0NzY4NDAzOA==,287,Read HTTP/2.0 frames and error codes.,d8375b7bd6929509411e943449950df224fbc417,14,
MDExOlB1bGxSZXF1ZXN0NzcxODM5OA==,289,the numberOfPairs may not be negative when numberOfPairs*2 is negative,a69a5fa1cdc1de40d10c264d99780ab88ee6984a,1,
MDExOlB1bGxSZXF1ZXN0NzgzMjU3Mg==,295,Switch NPN from optional to provided.,9b96ff1724868b24c9dd77ee09f4185c01ab0605,1,
MDExOlB1bGxSZXF1ZXN0NzgzOTgzNQ==,297,Drop body headers when redirected from POST to GET.,0e6cc65c5bb55e7020f6f6e8badc6882b7f309d5,3,
MDExOlB1bGxSZXF1ZXN0Nzg1MDkyMw==,299,"Implement HPACK, HTTP header compression.",985860f1fb2c41e731e72c69a0e432f6045eee07,9,
MDExOlB1bGxSZXF1ZXN0NzkyMzMzNQ==,301,When invalid sizes are used to initialize the ArrayList,892e78c76dc30111a2e2308ea6547de5f541880c,1,
MDExOlB1bGxSZXF1ZXN0Nzk0MzQ5NA==,302,Continue to read old bad cache responses.,4f1ec1c24d1cb91cbca4641c91cdf1b48ec5d10f,4,
MDExOlB1bGxSZXF1ZXN0ODAwOTYyNQ==,306,"Use one callback for SYN_STREAM, SYN_REPLY and HEADERS.",45330553d01e9bcf8acef40bfcf8dfec4f5858c7,8,
MDExOlB1bGxSZXF1ZXN0ODAxODgyNQ==,307,Upstream changes made directly to AOSP.,398f189ef9bb8e17d5f3b71d26b298e1467d7ac8,8,
MDExOlB1bGxSZXF1ZXN0ODAyMzk1Nw==,308,issue-265 Multiple HTTP Cookie: headers,08ee439998b1a5c8178a153177b60b420a6fcaab,1,
MDExOlB1bGxSZXF1ZXN0ODAyNTUzNg==,309,Write some HTTP/2.0 frames,14781c3ff927be4ed520f1f7108435f5b4e528e3,6,
MDExOlB1bGxSZXF1ZXN0ODA0NDY2MA==,312,Fix checkstyle issues in new Cookie code.,b781fa3d1d2910988d4a964db6810cb01a4a22e2,1,
MDExOlB1bGxSZXF1ZXN0ODE1NzY4MA==,314,Static HTTPS/SPDY3/HTTP2 server example,4d34e21e70815b9fc5a0f6cbb75bbefbae3812d3,5,
MDExOlB1bGxSZXF1ZXN0ODM0NzIxNQ==,315,Bug fixed that caused gzipped responses to be returned from cache after ...,be74321174f74dc340f37d9629d29dc0cd621cd5,2,
MDExOlB1bGxSZXF1ZXN0ODQzNzA0MA==,316,Use 'jar-with-dependencies' classifier on website.,70bc53acb6cb2fb1f54cbf0b015a60997b7a82bf,2,
MDExOlB1bGxSZXF1ZXN0ODUyNDUxOA==,318,returning null where a Map is expected is not nice,d372d6ffeabf2538cf67d2319822d8468dcc2d0e,1,
MDExOlB1bGxSZXF1ZXN0ODY4NTMzMg==,320,Fix a race condition in Connection.isExpired().,c0f03009c124824577aa20f2890662ab4f073ae7,4,
MDExOlB1bGxSZXF1ZXN0ODkxNzYwNA==,322,Fix unresolved function call on JVM < 1.7,72911c64db5381ea509ba985f54d241e2b06a126,1,
MDExOlB1bGxSZXF1ZXN0OTAxMTg5OA==,325,Hide a 2.0 API that was left public.,df3bfd4ceae10b76e1fffaa49c99bf558e40355f,1,
MDExOlB1bGxSZXF1ZXN0OTAyNjM3NQ==,327,Added description and download info for MockWebServer.,221025cac516d8de5ad5679fc3c6e203ff48012f,1,
MDExOlB1bGxSZXF1ZXN0OTA0NTU5Ng==,329,Allow specifying a socket factory for connections.,72385ff2ac4385b1bc5431b607f30327e2676525,6,
MDExOlB1bGxSZXF1ZXN0MTEzNDgxMTE=,424,Connected after everything is initialized,5b891a3c54efab0ce11021f2e82256a0e17bf473,1,
MDExOlB1bGxSZXF1ZXN0MTEzODgyODY=,425,Test that POST bodies are retransmitted on redirect.,d06ae80ef2b84a578c0145885e82f858764847cd,1,
